{
  "schema_version": "github.activity.plan.v1",
  "generated_at": "2026-05-19T00:00:00+00:00",
  "shiplog_version": "0.9.0",
  "activity_id": "github_activity_example",
  "actor": "EffortlessSteven",
  "repo_owners": [
    "EffortlessMetrics",
    "EffortlessSteven"
  ],
  "owner_filter_requested": true,
  "query_strategy": "actor_search_owner_filter",
  "profile": "full",
  "since": "2026-01-01",
  "until": "2026-02-01",
  "planning_mode": "static",
  "windows": [
    {
      "window_id": "2026-01",
      "since": "2026-01-01",
      "until": "2026-02-01",
      "granularity": "month",
      "query_kinds": [
        "authored_prs",
        "reviewed_prs"
      ],
      "queries": [
        {
          "query_kind": "authored_prs",
          "search_query": "is:pr author:EffortlessSteven created:2026-01-01..2026-01-31",
          "estimated_search_requests": 11,
          "estimated_core_requests": 1000,
          "estimated_review_requests": 0,
          "dense_window_risk": "unknown",
          "cache_reuse": "unknown"
        },
        {
          "query_kind": "reviewed_prs",
          "search_query": "is:pr reviewed-by:EffortlessSteven updated:2026-01-01..2026-01-31",
          "estimated_search_requests": 11,
          "estimated_core_requests": 0,
          "estimated_review_requests": 1000,
          "dense_window_risk": "unknown",
          "cache_reuse": "unknown"
        }
      ]
    }
  ],
  "estimated_totals": {
    "search_requests": 22,
    "core_requests": 2000,
    "review_requests": 1000
  },
  "budget_policy": {
    "max_search_requests": 300,
    "max_core_requests": 1000,
    "max_search_per_minute": 24,
    "on_exhausted": "checkpoint_and_stop"
  },
  "next_actions": [
    {
      "command": "shiplog github activity run --profile full --resume",
      "writes": true,
      "reason": "Fetch authored PR details and review activity using the planned activity scope."
    }
  ],
  "receipt_refs": []
}
